847;FACULDADE PIAUIENSE DE PROCESSAMENTO DE DADOS;FPPD;22
848;FACULDADE PARAIBANA DE PROCESSAMENTO DE DADOS;FPPD;25
849;FACULDADE JESUÍTA DE FILOSOFIA E TEOLOGIA;FAJE;31
852;FACULDADE DE INFORMÁTICA E ADMINISTRAÇÃO PAULISTA;FIAP;35
861;CENTRO DE ENSINO SUPERIOR DO AMAPÁ;CEAP;16
862;FACULDADE ESTÁCIO DE SÁ DE CAMPO GRANDE;FESCG;50
866;FACULDADE DE INFORMÁTICA DE CUIABÁ;FIC;51
873;FACULDADES UNIFICADAS DE FOZ DO IGUAÇU;UNIFOZ;41
874;FACULDADE DE ESTUDOS SOCIAIS APLICADOS DE VIANA;FESAV;32
877;FACULDADE DE ECONOMIA E PROCESSAMENTO DE DADOS DE FOZ DO IGUAÇU;FEPI;41
878;CENTRO UNIVERSITÁRIO DO LESTE DE MINAS GERAIS;UNILESTEMG;31
881;INSTITUTO MUNICIPAL DE ENSINO SUPERIOR DE ASSIS;IMESA;35
882;INSTITUTO MUNICIPAL DE ENSINO SUPERIOR DE BEBEDOURO VICTÓRIO CARDASSI;IMESB;35
886;FACULDADE DE HORTOLÂNDIA;FACH;35
890;ESCOLA DE GOVERNO PROFESSOR PAULO NEVES DE CARVALHO;EG;31
891;FACULDADE ANHANGUERA DE BELO HORIZONTE;;31
898;FACULDADE DE CIÊNCIAS ECONÔMICAS E ADMINISTRATIVAS SANTA RITA DE CÁSSIA;FACEAS;35
900;FACULDADE DE CIÊNCIAS ADMINISTRATIVAS E DE TECNOLOGIA;FATEC;11
905;FACULDADE ESCOLA PAULISTA DE DIREITO;FACEPD;35
906;FACULDADE DE EDUCAÇÃO E CIÊNCIAS GERENCIAIS DE SUMARÉ;FECGS;35
907;FACULDADE DE EDUCAÇÃO E CIÊNCIAS GERENCIAIS DE INDAIATUBA;FECGI;35
908;FACULDADE ALAGOANA DE ADMINISTRAÇÃO;FAA;27
909;FACULDADE DE BELFORD ROXO;FABEL;33
910;FACULDADE SANTA LÚCIA;FCACSL;35
913;FACULDADES INTEGRADAS DE PARANAÍBA - FIPAR;FIPAR;50
915;FACULDADE DE ADMINISTRAÇÃO DE FÁTIMA DO SUL;FAFS;50
916;FACULDADE DE CIÊNCIAS, SAÚDE, EXATAS E JURÍDICAS DE TERESINA;FACULDADE CEUT;22
917;FACULDADE DE CIÊNCIAS CONTÁBEIS DE NAVIRAI;FACINAV;50
918;FACULDADE DE CIÊNCIAS SOCIAIS APLICADAS DE CASCAVEL;FCSAC;41
922;FACULDADE REGES DE DRACENA;FCGD;35
923;FACULDADE DE ADMINISTRAÇÃO E CIÊNCIAS CONTÁBEIS DE SÃO ROQUE;FACCSR;35
924;FACULDADE INTERLAGOS DE EDUCAÇÃO E CULTURA;FINTEC;35
926;CENTRO UNIVERSITÁRIO ANHANGUERA DE CAMPO GRANDE;;50
939;FACULDADE CATÓLICA DE ANÁPOLIS;CATÓLICA DE ANÁPOLIS;52
940;Faculdades Magsul;FAMAG;50
944;ESCOLA SUPERIOR DE PROPAGANDA E MARKETING DO RIO DE JANEIRO;ESPM;33
945;INSTITUTO DE CIÊNCIAS SOCIAIS E HUMANAS;INCISOH;31
950;UNIÃO DE ENSINO SUPERIOR DE NOVA MUTUM;UNINOVA;51
952;UNIVERSIDADE SANTA CECÍLIA;UNISANTA;35
953;UNIVERSIDADE METROPOLITANA DE SANTOS;UNIMES;35
959;FACULDADE DE FILOSOFIA CIÊNCIAS E LETRAS;FAFIL;25
967;FACULDADE DE TECNOLOGIA DE TAQUARITINGA;FATEC/TQ;35
973;FACULDADE DE LUCÉLIA;;35
976;FACULDADES INTEGRADAS DE PONTA PORÃ;FIP;50
977;FACULDADE SÃO CAMILO;;29
983;FACULDADE PRUDENTE DE MORAES;FPM;35
985;FACULDADE DE CIÊNCIAS E EDUCAÇÃO DE RUBIATABA;FACER;52
986;FACULDADE DE EDUCAÇÃO E CULTURA MONTESSORI;FAMEC;35
989;ESCOLA SUPERIOR EM MEIO AMBIENTE;ESMA;31
990;FACULDADE DE FILOSOFIA CIÊNCIAS E LETRAS DE CONGONHAS;FAFIC;31
991;FACULDADE SENAI-CETIQT;SENAI-CETIQT;33
994;FACULDADE FLAMA;;33
997;Centro Universitário de Bauru;;35
1012;FACULDADE DE FORMAÇÃO DE PROFESSORES DE AFOGADOS DA INGAZEIRA;FAFOPAI;26
1013;FACULDADE SUDOESTE PAULISTANO;FASUP;35
1014;INSTITUTO SUPERIOR E CENTRO EDUCACIONAL LUTERANO - BOM JESUS - IELUSC;BOM JESUS/IELUSC;42
1019;FACULDADE DE CIÊNCIAS E TECNOLOGIA DE UNAÍ - FACTU;FACTU;31
1021;FACULDADE DE CIÊNCIAS DE TIMBAÚBA;FACET;26
1027;UNIVERSIDADE ESTADUAL DO NORTE FLUMINENSE DARCY RIBEIRO;UENF;33
1028;UNIVERSIDADE ESTADUAL DE MATO GROSSO DO SUL;UEMS;50
1030;FACULDADE DE ECONOMIA E FINANÇAS IBMEC;FACULDADES IBMEC;33
1032;CENTRO UNIVERSITÁRIO SALESIANO DE SÃO PAULO;UNISAL;35
1034;UNIÃO DE ESCOLAS SUPERIORES DA FUNESO;UNESF;26
1036;UNIVERSIDADE DO ESTADO DE MINAS GERAIS;UEMG;31
1038;FACULDADES INTEGRADAS DE TRÊS LAGOAS;AEMS;50
1041;CENTRO UNIVERSITÁRIO UNIVATES;UNIVATES;43
1042;UNIVERSIDADE POSITIVO;UP;41
1043;CENTRO UNIVERSITÁRIO HERMINIO OMETTO DE ARARAS;UNIARARAS;35
1045;CENTRO UNIVERSITÁRIO ANHANGÜERA;UNIFIAN;35
1046;UNIÃO DAS FACULDADES DOS GRANDES LAGOS - UNILAGO;UNILAGO;35
1048;FACULDADE CAMPOS ELÍSEOS;FCE;35
1049;INSTITUTO DE ENSINO SUPERIOR FUCAPI;CESF;13
1051;FACULDADE DE CIÊNCIAS CONTÁBEIS - MACEIÓ;SEUNE;27
1053;FACULDADE DE TECNOLOGIA E CIÊNCIAS DE FEIRA DE SANTANA;FTC;29
1055;FACULDADE MAURÍCIO DE NASSAU DE SALVADOR;FMN SALVADOR;29
1058;Centro Universitário Estácio da Bahia - Estácio FIB;FIB;29
1059;FACULDADE LOURENÇO FILHO;FLF;23
1060;CENTRO UNIVERSITÁRIO DO INSTITUTO DE EDUCAÇÃO SUPERIOR DE BRASÍLIA - IESB;IESB;53
1063;FACULDADE BATISTA DE VILA VELHA;FABAVI;32
1064;FACULDADE BATISTA DE VITÓRIA;FABAVI;32
1065;FACULDADE DE CIÊNCIAS ECONÔMICAS E ADMINISTRATIVAS DE VILA VELHA;;32
1066;INSTITUTO DE ENSINO E PESQUISA OBJETIVO;IEPO;17
1067;FACULDADE DE JUSSARA;FAJ;52
1068;FACULDADE ALDETE MARIA ALVES;FAMA;31
1070;INSTITUTO DE ENSINO SUPERIOR CENECISTA;INESC;31
1071;INSTITUTO DE ENSINO SUPERIOR DA FUNLEC;IESF;50
1072;FACULDADE AFIRMATIVO;FAFI;51
1075;INSTITUTO DE EDUCAÇÃO SUPERIOR DA PARAÍBA;IESP;25
1076;FACULDADE DE FILOSOFIA, CIÊNCIAS E LETRAS DE CAJAZEIRAS;FAFIC;25
1077;Faculdade Estácio do Recife - Estácio FIR;FIR;26
1078;FACULDADE INTEGRADO DE CAMPO MOURÃO;CEI;41
1079;FACULDADE MARINGÁ;CESPAR;41
1080;FACULDADE ARTHUR SÁ EARP NETO;FASE;33
1081;FACULDADE DE ENGENHARIA DE RESENDE;FER;33
1082;INSTITUTO FEDERAL DE EDUCAÇÃO, CIÊNCIA E TECNOLOGIA DO RIO GRANDE DO NORTE;IFRN;24
1084;FACULDADE CENECISTA DE BENTO GONÇALVES;FACEBG;43
1085;FACULDADE METODISTA DE SANTA MARIA;FAMES;43
1086;FACULDADE DE EDUCAÇÃO DE COLORADO DO OESTE;FAEC;11
1087;FACULDADES INTEGRADAS APARÍCIO CARVALHO;FIMCA;11
1090;FACULDADE SÃO LUÍS DE FRANÇA;FSLF;28
1092;FACULDADES INTEGRADAS DE BAURU;FIB;35
1093;FACULDADE DE CIÊNCIAS JURÍDICAS E GERENCIAIS DE GARÇA;FAEG;35
1096;FACULDADE DE PRESIDENTE EPITÁCIO - FAPE;FAPE;35
1097;FACULDADES INTEGRADAS DE SÃO PAULO;FISP;35
1099;FACULDADE DE EDUCAÇÃO E CIÊNCIAS GERENCIAIS DE SÃO PAULO;FECG-SP;35
1100;FACULDADE CARLOS DRUMMOND DE ANDRADE;FCDA;35
1103;FACULDADE DE ADMINISTRAÇÃO SÃO PAULO;FAPI;35
1107;Faculdade Estácio do Ceará - Estácio FIC;FIC;23
1113;CENTRO UNIVERSITÁRIO EURO-AMERICANO;UNIEURO;53
1115;FACULDADE SANTA TEREZINHA;CEST;21
1118;UNIÃO DAS ESCOLAS DO GRUPO FAIMI DE EDUCAÇÃO;FAIMI;35
1120;INSTITUTO FEDERAL DE EDUCAÇÃO, CIÊNCIA E TECNOLOGIA FLUMINENSE;IF Fluminense;33
1122;FACULDADE OSVALDO CRUZ;;35
1123;INSTITUTO DE EDUCAÇÃO SUPERIOR UNYAHNA DE SALVADOR;IESUS;29
1124;INSTITUTO DE EDUCAÇÃO SUPERIOR UNYAHNA DE BARREIRAS;IESUB;29
1125;FACULDADES INTEGRADAS ESPÍRITA;FIES;41
1126;UNIVERSIDADE ESTADUAL DO CENTRO OESTE;UNICENTRO;41
1128;UNIVERSIDADE DE ITAÚNA;UI;31
1129;CENTRO UNIVERSITÁRIO DO NORTE PAULISTA;UNORP;35
1130;FACULDADE METODISTA DE CIÊNCIAS HUMANAS E EXATAS;METODISTA;35
1131;FACULDADE SANTO AGOSTINHO;FSA;22
1136;FACULDADE DE CIÊNCIAS HUMANAS E SOCIAIS DE IGARASSU;FACIG;26
1139;FACULDADE DE ESTUDOS ADMINISTRATIVOS DE MINAS GERAIS - FEAD-MG;FEAD - MG;31
1141;FACULDADE GAMA E SOUZA;FGS;33
1142;FACULDADES INTEGRADAS DE VITÓRIA;FDV;32
1143;FACULDADE DE EDUCAÇÃO SUPERIOR DE TIMBAÚBA;FAEST;26
1144;FACULDADE DE CIÊNCIAS HUMANAS;IMENSU;35
1149;CENTRO UNIVERSITÁRIO NOSSA SENHORA DO PATROCÍNIO;CEUNSP;35
1150;FACULDADE SENAI DE TECNOLOGIA GRÁFICA;SP SENAI;35
1151;FACULDADE DE ADMINISTRAÇÃO E NEGÓCIOS DE SERGIPE;FANESE;28
1153;UNIVERSIDADE CÂNDIDO MENDES;UCAM;33
1155;FACULDADE SALESIANA DE SANTA TERESA;FSST;50
1156;FACULDADE CENECISTA DE ITABORAÍ;FACNEC;33
1157;ESCOLA SUPERIOR SÃO FRANCISCO DE ASSIS;ESFA;32
1159;CENTRO DE ENSINO SUPERIOR DE VITÓRIA;CESV;32
1160;FACULDADE CAMBURY;CAMBURY;52
1161;INSPER INSTITUTO DE ENSINO E PESQUISA;INSPER;35
1162;FACULDADE DE ALTA FLORESTA;FAF;51
1166;INSTITUTO FEDERAL DE EDUCAÇÃO, CIÊNCIA E TECNOLOGIA  DA PARAÍBA;IFPB;25
1170;FACULDADE METROPOLITANA DE CAMAÇARI;FAMEC;29
1173;FACULDADE ANHANGUERA DE BRASÍLIA;FAB;53
1174;FACULDADE DE SABARÁ;SOECS;31
1175;FACULDADES RIOGRANDENSES;FARGS;43
1181;FACULDADE BRASÍLIA DE SÃO PAULO;FABRASP;35
1182;INSTITUTO DE ENSINO SUPERIOR DE AMERICANA;IESA;35
1185;CENTRO UNIVERSITÁRIO JORGE AMADO;UNIJORGE;29
1187;CENTRO UNIVERSITÁRIO MÓDULO;MÓDULO;35
1189;UNIVERSIDADE DO PLANALTO CATARINENSE;UNIPLAC;42
1190;FACULDADE INTEGRAL CANTAREIRA;F.I.C.;35
1191;INSTITUTO DE ENSINO SUPERIOR DE FORTALEZA;IESF;23
1192;FACULDADE DE CIÊNCIAS DA SAÚDE DE SÃO PAULO;FACIS;35
1194;FACULDADE DE TECNOLOGIA DE PONTA PORÃ;FATEP;50
1195;FACULDADE SENAI DE TECNOLOGIA MECATRÔNICA;SENAI;35
1196;CENTRO UNIVERSITÁRIO DE MARINGÁ - CEUMAR;CESUMAR;41
1198;FACULDADE DE CIÊNCIAS SOCIAIS E APLICADAS DO PARANÁ;FACET;41
1201;FACULDADE DE ADMINISTRAÇÃO MILTON CAMPOS;FAMC;31
1202;FACULDADE SANTA RITA;FASAR;31
1204;FACULDADE DE AMAMBAI;FIAMA;50
1205;FACULDADE EDUCACIONAL DA LAPA;FAEL;41
1208;FACULDADE DE NATAL;FAL;24
1212;FACULDADE DE CIÊNCIAS CONTÁBEIS DE ASSIS;FCCA;35
1213;FACULDADE FLEMING;SEF;35
1219;INSTITUTO ITAPETININGANO DE ENSINO SUPERIOR;IIES;35
1221;FACULDADE GAMMON;;35
1224;CENTRO UNIVERSITÁRIO DE JALES;UNIJALES;35
1225;CENTRO UNIVERSITÁRIO AMPARENSE;UNIFIA;35
1226;INSTITUTO DE ENSINO SUPERIOR DO ACRE;IESACRE;12
1227;FACULDADE SÃO FRANCISCO DE BARREIRAS - FASB;FASB;29
1230;CENTRO REGIONAL UNIVERSITÁRIO DE ESPÍRITO SANTO DO PINHAL;UNIPINHAL;35
1231;INSTITUTO CENECISTA DE ENSINO SUPERIOR DE SANTO ÂNGELO;CNEC/IESA;43
1232;CENTRO UNIVERSITÁRIO CAMPOS DE ANDRADE;UNIANDRADE;41
1233;CENTRO UNIVERSITÁRIO CÂNDIDO RONDON;UNIRONDON;51
1237;FACULDADE NOSSA SENHORA APARECIDA;FANAP;52
1239;FACULDADE PADRÃO;PADRAO;52
1240;FACULDADE DE ESTUDOS SOCIAIS DO ESPÍRITO SANTO;PIO XII;32
1243;FACULDADE DE ADMINISTRAÇÃO DA SERRA;FABAVI;32
1244;FACULDADE BRASILEIRA;;32
1245;FACULDADE DE CASTELO;FACASTELO;32
1246;FACULDADE CANDIDO MENDES DE VITÓRIA;FCMV;32
1247;FACULDADE DE CIÊNCIAS CONTÁBEIS DE NOVA ANDRADINA - FACINAN;FACINAN;50
1248;FACULDADE DE PEDAGOGIA;ANAEC;50
1249;FACULDADE DE EDUCAÇÃO DE COSTA RICA;FECRA;50
1252;FACULDADE PROMOVE DE MINAS GERAIS;PROMOVE;31
1253;FACULDADE METODISTA GRANBERY;FMG;31
1254;FACULDADE DE ADMINISTRAÇÃO DE ITABIRITO;FAI;31
1255;FACULDADE BOA VIAGEM;FBV;26
1256;FACULDADE DOM BOSCO;DOM BOSCO;41
1257;FACULDADE DE ADMINISTRAÇÃO, CIÊNCIAS, EDUCAÇÃO E LETRAS;FACEL;41
1258;FACULDADE DE CIÊNCIAS APLICADAS DE CASCAVEL;FACIAP;41
1263;FACULDADE BEZERRA DE ARAÚJO;FABA;33
1264;FACULDADE NATALENSE PARA O DESENVOLVIMENTO DO RIO GRANDE DO NORTE;FARN;24
1266;FACULDADES INTEGRADAS URUBUPUNGÁ;FIU;35
1267;INSTITUTO DE ENSINO SUPERIOR DA GRANDE FLORIANÓPOLIS;IESGF;42
1270;CENTRO UNIVERSITÁRIO DO INSTITUTO DE ENSINO SUPERIOR COC;COC;35
1272;FACULDADE SANT´ANNA DE SALTO;FASAS;35
1273;FACULDADE CAMPO LIMPO PAULISTA;FACCAMP;35
1275;FACULDADE DO GUARUJÁ;FAGU;35
1276;INSTITUTO TAUBATÉ DE ENSINO SUPERIOR;I.T.E.S.;35
1279;FACULDADE DE ITÁPOLIS - FACITA;FACITA;35
1280;Faculdade Estácio Cotia - Estácio FAAC;IESC;35
1281;FACULDADE DE CIÊNCIAS SOCIAIS E AGRÁRIAS DE ITAPEVA;FAIT;35
1283;INSTITUTO MANCHESTER PAULISTA DE ENSINO SUPERIOR;IMAPES;35
1286;FACULDADE SENAI DE TECNOLOGIA AMBIENTAL;SENAI;35
1289;FACULDADE DE DIREITO DA FUNDAÇÃO ARMANDO ALVARES PENTEADO;FAD-FAAP;35
1290;FACULDADE ALBERT EINSTEIN DE SÃO PAULO;FAESP;35
1291;FACULDADE DO NORTE PIONEIRO;FANORPI;41
1292;FACULDADES ADAMANTINENSES INTEGRADAS;FAI;35
1294;FACULDADE DAS AMÉRICAS;FAM;35
1295;FACULDADE MORUMBI SUL;FMS;35
1296;ESCOLA SUPERIOR DE MARKETING;ESM;26
1298;Faculdade Estácio de Alagoas - Estácio FAL;FAL;27
1299;FACULDADES INTEGRADAS DE FERNANDÓPOLIS;FIFE;35
1300;INSTITUTO TAQUARITINGUENSE DE ENSINO SUPERIOR DR. ARISTIDES DE CARVALHO SCHLOBACH;ITES;35
1301;INSTITUTO MATONENSE MUNICIPAL DE ENSINO SUPERIOR;IMMES;35
1302;FACULDADE BATISTA BRASILEIRA;FBB;29
1303;INSTITUTO FEDERAL DE EDUCAÇÃO, CIÊNCIA E TECNOLOGIA GOIANO;IF Goiano;52
1304;FACULDADES INTEGRADAS DE RIBEIRÃO PIRES;FIRP;35
1305;FACULDADE DE CIÊNCIAS JURÍDICAS, GERENCIAIS E EDUCAÇÃO DE SINOP;FIS;51
1307;FACULDADE DE CIÊNCIAS HUMANAS DE GARÇA;FAHU;35
1308;FACULDADE NOVO MILÊNIO;FNM;32
1309;FACULDADE JESUS MARIA JOSÉ;FAJESU;53
1310;FACULDADE DE AMERICANA;FAM;35
1311;TREVISAN ESCOLA SUPERIOR DE NEGÓCIOS;TREVISAN;35
1312;FACULDADES INTEGRADAS DE RONDONÓPOLIS;UNIR;51
1313;FACULDADE UNIDA DE SUZANO;UNISUZ;35
1314;INSTITUTO DE ENSINO SUPERIOR JOÃO ALFREDO DE ANDRADE;IJAA;31
1315;FACULDADE DE EDUCAÇÃO DA SERRA;FASE;32
1317;FACULDADE SUDOESTE PAULISTA;FSP;35
1318;FACULDADE JUVÊNCIO TERRA;FJT;29
1319;FACULDADE TECSOMA;FATEC;31
1322;FACULDADE EDUVALE DE AVARÉ;EDUVALE;35
1324;FACULDADE DE INFORMÁTICA LEMOS DE CASTRO;FILC;33
1325;FACULDADE DE APUCARANA;FAP;41
1326;ESCOLA SUPERIOR DE ENSINO ANÍSIO TEIXEIRA;CESAT;32
1327;ESCOLA SUPERIOR DE PROPAGANDA E MARKETING DE PORTO ALEGRE;ESPM - POA;43
1328;FACULDADE DE COMUNICAÇÃO E TURISMO DE OLINDA;FACOTTUR;26
1330;FACULDADE COTEMIG;COTEMIG;31
1333;FACULDADE CECAP DO LAGO NORTE;CECAP;53
1334;FACULDADE DE CIÊNCIAS SOCIAIS APLICADAS - FACISA;FACISA;25
1335;INSTITUTO DE ENSINO SUPERIOR THATHI;FACULDADE THATHI COC;35
1336;FACULDADE ASSIS GURGACZ;FAG;41
1337;FACULDADE MATER DEI;FMD;41
1342;FACULDADE DE PEDAGOGIA DA SERRA;FABAVI;32
1344;FACULDADE BORGES DE MENDONÇA;FBM;42
1345;FACULDADE ANHANGUERA DE OSASCO;FIZO;35
1346;FACULDADE BATISTA DE MINAS GERAIS;FBMG;31
1350;FACULDADE DO VALE DO JAGUARIBE;FVJ;23
1351;INSTITUTO SUPERIOR TUPY - IST;IST;42
1353;INSTITUTO DE ENSINO SUPERIOR DE GARÇA;IESG;35
1355;FACULDADES INTEGRADAS DE JAHU;FIJ;35
1356;FACULDADES INTEGRADAS DE SANTA FÉ DO SUL;FUNEC;35
1357;INSTITUTO SUPERIOR DE EDUCAÇÃO DO RIO DE JANEIRO;ISERJ;33
1358;FACULDADE DE PEDAGOGIA DE AFONSO CLÁUDIO;ISEAC;32
1359;FACULDADE CAPIXABA DE NOVA VENÉCIA;;32
1360;FACULDADE SÃO GABRIEL;FSG;22
1362;FACULDADE UBAENSE OZANAM COELHO;FAGOC;31
1363;FACULDADE VISCONDE DE CAIRÚ;FAVIC;29
1364;FACULDADE DE TECNOLOGIA E CIÊNCIAS DE VITÓRIA DA CONQUISTA;FTC;29
1365;CENTRO UNIVERSITÁRIO ADVENTISTA DE SÃO PAULO;UNASP;35
1366;FACULDADE BARDDAL;FB-SI;42
1371;FACULDADE DE MIRANDÓPOLIS;FAM;35
1373;FACULDADE CASA BRANCA;FACAB;35
1374;FACULDADE DE CIÊNCIAS SOCIAIS DE GUARANTÃ DO NORTE;FCSGN;51
1375;FACULDADE CATÓLICA RAINHA DA PAZ DE ARAPUTANGA;FCARP;51
1379;FACULDADES INTEGRADAS SÃO PEDRO;FAESA;32
1381;FACULDADE MARTHA FALCÃO;FMF;13
1382;ESCOLA SUPERIOR DE TEOLOGIA;EST;43
1383;FACULDADE JOSÉ LACERDA FILHO DE CIÊNCIAS APLICADAS;FAJOLCA;26
1384;FACULDADE SANTA HELENA;FSH;26
1385;FACULDADES INTEGRADAS IPEP;FIPEP;35
1386;ESCOLA SUPERIOR DE ADMINISTRAÇÃO, MARKETING E COMUNICAÇÃO DE CAMPINAS - ESAMC CAMPINAS;ESAMC DE CAMPINAS;35
1388;FACULDADE SUMARÉ;ISES;35
1394;FACULDADE CASTRO ALVES;FCA;29
1395;FACULDADE DE CALDAS NOVAS;UNICALDAS;52
1396;FACULDADE DINÂMICA DAS CATARATAS;UDC;41
1399;FACULDADE UNISSA DE SARANDI;UNISSA;41
1400;FACULDADE METROPOLITANA DE CURITIBA;FAMEC;41
1401;FACULDADE ADELMAR ROSADO;FAR;22
1402;INSTITUTO DE CIÊNCIAS SOCIAIS E HUMANAS;ICSH;52
1403;FACULDADE DE PIMENTA BUENO;FAP;11
1404;FACULDADE DE PIRACANJUBA;FAP;52
1409;FACULDADE DO CENTRO LESTE;UCL;32
1410;ÁREA1 - FACULDADE DE CIÊNCIA E TECNOLOGIA;ÁREA1;29
1411;FACULDADE DOIS DE JULHO;F2J;29
1412;FACULDADE ANHAGUERA DE JUNDIAÍ;;35
1413;FACULDADE DE PRIMAVERA;CESPRI;35
1414;FACULDADE SÃO LUCAS;FSL;11
1415;FACULDADE MAGISTER;MAGISTER;35
1417;FACULDADE CENECISTA DE CAMPO LARGO;FACECLA;41
1418;CENTRO UNIVERSITÁRIO TOLEDO;UNITOLEDO;35
1419;CENTRO UNIVERSITÁRIO CURITIBA;UNICURITIBA;41
1420;FACULDADES DE DRACENA;;35
1422;CENTRO UNIVERSITÁRIO DO NORTE;UNINORTE;13
1423;FACULDADE IDEAL;FACI;15
1426;INSTITUTO LUTERANO DE ENSINO SUPERIOR DE ITUMBIARA;ILES;52
1427;FACULDADE DA SERRA GAÚCHA;FSG;43
1428;INSTITUTO DE ENSINO SUPERIOR PLANALTO;IESPLAN;53
1429;FACULDADE BATISTA DO RIO DE JANEIRO;FABAT;33
1430;FACULDADE INGÁ;;41
1432;FACULDADE BERTIOGA;FABE;35
1433;FACULDADE ORÍGENES LESSA;FACOL;35
1434;INSTITUTO DE ENSINO SUPERIOR DE ITAPIRA;IESI;35
1435;FACULDADE DE VILA VELHA;;32
1436;ESCOLA SUPERIOR BATISTA DO AMAZONAS;ESBAM;13
1437;ESCOLA SUPERIOR DE TECNOLOGIA E EDUCAÇÃO DE RIO CLARO;ESRC;35
1438;FACULDADE DE ADMINISTRAÇÃO DE EMPRESAS;FACAMP;35
1439;FACULDADE DE CIÊNCIAS ECONÔMICAS;FACAMP;35
1440;INSTITUTO APHONSIANO DE ENSINO SUPERIOR;IAESUP;52
1441;FACULDADE DE TECNOLOGIA DO PIAUÍ;FATEPI;22
1442;FACULDADE DE DIREITO DE TANGARÁ DA SERRA;UNIC;51
1443;FACULDADE NACIONAL;FINAC;32
1444;FACULDADES INTEGRADAS EINSTEIN DE LIMEIRA;FIEL;35
1445;CENTRO UNIVERSITÁRIO DO INSTITUTO MAUÁ DE TECNOLOGIA;CEUN-IMT;35
1446;CENTRO UNIVERSITÁRIO PLANALTO DO DISTRITO FEDERAL - UNIPLAN;UNIPLAN;53
1449;FACULDADE DE EDUCAÇÃO, ADMINISTRAÇÃO E TECNOLOGIA DE IBAITI;FEATI;41
1450;CENTRO UNIVERSITÁRIO DO CERRADO-PATROCÍNIO;UNICERP;31
1451;FACULDADES INTEGRADAS DE SÃO CARLOS;FADISC;35
1452;FACULDADE ATENAS MARANHENSE;FAMA;21
1453;FACULDADE CIODONTO;-;41
1454;FACULDADE SALESIANA DO NORDESTE;FASNE;26
1455;FACULDADE SANTÍSSIMO SACRAMENTO;FSSS;29
1456;FACULDADE ANHANGUERA DE SERTÃOZINHO;FASERT;35
1457;Faculdade Estácio Euro- Panamericana de Humanidades e Tecnologias - Estácio EUROPAN;EUROPAN;35
1459;FACULDADE DE CIÊNCIAS HUMANAS E SOCIAIS;FUCAMP;31
1461;FACULDADE DE TECNOLOGIA E CIÊNCIAS;FTC SALVADOR;29
1462;INSTITUTO PARAIBANO DE ENSINO RENOVADO;INPER;25
1463;FACULDADE ALFACASTELO;FCGB;35
1464;FACULDADE MÓDULO PAULISTA;FMP;35
1465;FACULDADE DE RIBEIRÃO PRETO;FABAN;35
1467;FACULDADE CENECISTA DE VILA VELHA;FACEVV;32
1468;ESCOLA SUPERIOR DE ADMINISTRAÇÃO, MARKETING E COMUNICAÇÃO DE UBERLÂNDIA;ESAMC DE UBERLÂNDIA;31
1469;FACULDADE DE CIÊNCIAS SOCIAIS DE FLORIANÓPOLIS;FCSF;42
1472;CENTRO UNIVERSITÁRIO LEONARDO DA VINCI;UNIASSELVI;42
1476;FACULDADES INTEGRADAS INTERAMERICANAS;FAITER;35
1478;FACULDADE ANCHIETA;IGABC;35
1484;FACULDADE IBMEC;IBMEC;31
1486;FACULDADE ESTÁCIO DE SÁ DE VITÓRIA;FESV;32
1487;FACULDADE DOM BOSCO;FDB;41
1488;FACULDADE PARAÍSO;FAP;33
1490;FACULDADE DE JAGUARIÚNA;FAJ;35
1491;FACULDADE INTERNACIONAL DE CURITIBA;FACINTER;41
1492;FACULDADE PITÁGORAS DE UBERLÂNDIA;PIT UBERLÂNDIA;31
1493;FACULDADE ALVES FARIA;ALFA;52
1494;FACULDADE CATÓLICA SALESIANA DO ESPÍRITO SANTO;;32
1496;FACULDADE ESTÁCIO DE SÁ DE VILA VELHA;FESVV;32
1497;FACULDADE DE ADMINISTRAÇÃO DE SANTA CRUZ DO RIO PARDO;FASC;35
1498;INSTITUTO DE ENSINO SUPERIOR E FORMAÇÃO AVANÇADA DE VITÓRIA;FAVI;32
1499;FACULDADE ANHANGUERA DE TABOÃO DA SERRA;FATS;35
1500;FACULDADE DE ENSINO SUPERIOR DE SÃO MIGUEL DO IGUAÇU;FAESI;41
1501;FACULDADE LATINO AMERICANA DE EDUCAÇÃO;FLATED;23
1502;FACULDADE PITÁGORAS DE JUNDIAÍ;PIT JUNDIAÍ;35
1503;FACULDADE DOUTOR LEOCÁDIO JOSÉ CORREIA;FALEC;41
1504;FACULDADE MAURÍCIO DE NASSAU DE MACEIÓ;;27
1505;FACULDADE DE MEDICINA VETERINÁRIA E ZOOTECNIA;FAMED;35
1506;INSTITUTO CENECISTA FAYAL DE ENSINO SUPERIOR;IFES;42
1507;FACULDADE PROJEÇÃO DE CEILÂNDIA;FACEB;53
1508;FACULDADE METROPOLITANA DE MARINGÁ;UNIFAMMA;41
1509;FACULDADE ESTÁCIO DE SÁ DE BELO HORIZONTE;FESBH;31
1510;FACULDADE ESTÁCIO DE SÁ DE SANTA CATARINA;FESSC;42
1513;INSTITUTO DE CIÊNCIAS JURÍDICAS E SOCIAIS PROFESSOR CAMILLO FILHO;ICF;22
1514;FACULDADE VALE DO CRICARÉ;F.V.C.;32
1515;FACULDADE DE EDUCAÇÃO DE PORTO VELHO;UNIRON;11
1516;FACULDADE DE VINHEDO;FV;35
1518;FACULDADE SANTA TEREZINHA;FAST;53
1519;FACULDADE DE PATO BRANCO;FADEP;41
1520;FACULDADE FIA DE ADMINISTRAÇÃO E NEGÓCIOS;FFA;35
1521;INSTITUTO DE ESTUDOS SUPERIORES DA AMAZÔNIA;IESAM;15
1523;FACULDADE DE DIREITO FRANCISCO BELTRÃO;CESUL;41
1524;FACULDADES INTEGRADAS OLGA METTIG;FAMETTIG;29
1525;FACULDADE DE CIÊNCIAS CONTÁBEIS DE AFONSO CLÁUDIO;ISEAC;32
1526;FACULDADE SENAI DE SÃO PAULO;SENAI;35
1530;FACULDADE CENECISTA DE JOINVILLE - FACE;FCJ;42
1532;FACULDADE DE FILOSOFIA, CIÊNCIAS E LETRAS NOSSA SENHORA APARECIDA;FNSA;35
1534;FACULDADE DE CIÊNCIAS, LETRAS E EDUCAÇÃO DO NOROESTE DO PARANÁ;FACLENOR;41
1535;FACULDADE SÃO JUDAS TADEU DE PINHAIS;FAPI;41
1536;FACULDADE DE TELÊMACO BORBA;FATEB;41
1538;FACULDADE PROJEÇÃO;FAPRO;53
1540;INSTITUTO DE ENSINO SUPERIOR DE RONDÔNIA;IESUR;11
1541;FACULDADE FLAMINGO;;35
1542;CENTRO UNIVERSITÁRIO GERALDO DI BIASE;UGB;33
1544;FACULDADE DECISÃO;FADEC;42
1545;INSTITUTO DE EDUCAÇÃO SUPERIOR DE BOITUVA;FIB;35
1546;FACULDADE DE EDUCAÇÃO SÃO FRANCISCO;FAESF;21
1547;FACULDADE DE MEDICINA ESTÁCIO DE JUAZEIRO DO NORTE;FMJ;23
1550;FACULDADE DE EDUCAÇÃO FÍSICA DE FOZ DO IGUAÇU;FEPI;41
1552;FACULDADE PIAUIENSE;FAP;22
1554;FACULDADES INTEGRADAS DO VALE DO RIBEIRA;FIVR;35
1556;FACULDADE SETE DE SETEMBRO;FA7;23
1557;UNIVERSIDADE FUMEC;FUMEC;31
1558;INSTITUTO DE ENSINO SUPERIOR DE JOÃO MONLEVADE;IES/FUNCEC;31
1559;CENTRO UNIVERSITÁRIO DO ESPÍRITO SANTO;UNESC;32
1561;ESCOLA SUPERIOR DE ADMINISTRAÇÃO, MARKETING E COMUNICAÇÃO DE SOROCABA;ESAMC  SOROCABA;35
1562;FACULDADE DE ILHA SOLTEIRA;FAISA;35
1563;FACULDADE DE SAÚDE, CIÊNCIAS HUMANAS E TECNOLÓGICAS DO PIAUÍ;NOVAFAPI;22
1564;FACULDADE SUL FLUMINENSE;FASF;33
1565;FACULDADE UNIME DE CIÊNCIAS JURÍDICAS;FCJ;29
1567;FACULDADE VIZINHANÇA VALE DO IGUAÇU;VIZIVALI;41
1568;FACULDADES INTEGRADAS DE CARATINGA;FIC;31
1569;FACULDADES INTEGRADAS DE ARARAQUARA;FIAR;35
1571;FACULDADE UNIME DE CIÊNCIAS SOCIAIS;FCS;29
1572;FACULDADE DE CIÊNCIAS SOCIAIS APLICADAS;FACISA;29
1573;FACULDADE ALFREDO NASSER;FAN;52
1574;FACULDADE EDUCACIONAL DE MEDIANEIRA;FACEMED;41
1575;CENTRO UNIVERSITÁRIO DO PLANALTO DE ARAXÁ;UNIARAXÁ;31
1576;INSTITUTO DE ENSINO SUPERIOR BLAURO CARDOSO DE MATTOS;FASERRA;32
1577;FACULDADE INTERMUNICIPAL DO NOROESTE DO PARANÁ;FACINOR;41
1578;INSTITUTO FEDERAL DE EDUCAÇÃO, CIÊNCIA E TECNOLOGIA SUL-RIO-GRANDENSE;IFSul;43
1580;FACULDADE DE CIÊNCIAS E EDUCAÇÃO SENA AIRES;FACESA;52
1581;FACULDADE DA CIDADE DE SANTA LUZIA;FACSAL;31
1582;FACULDADE DECISÃO;FADE;26
1583;FACULDADE DE TECNOLOGIA DE INDAIATUBA;FATEC-ID;35
1584;FACULDADE DE TECNOLOGIA DE GUARATINGUETÁ;FATEC GT;35
1585;FACULDADE ENERGIA DE ADMINISTRAÇÃO E NEGÓCIOS;FEAN;42
1586;UNIVERSIDADE DO VALE DO SAPUCAÍ;UNIVÁS;31
1587;FACULDADES INTEGRADAS DE TANGARÁ DA SERRA;FITS;51
1590;FACULDADE DE CIÊNCIAS HUMANAS E SOCIAIS APLICADAS;FACSÃOLUÍS;21
1591;FACULDADE SEAMA;SEAMA;16
1592;FACULDADE DE ODONTOLOGIA DE MANAUS;FOM;13
1596;FACULDADE DE CIÊNCIAS E EDUCAÇÃO DO ESPÍRITO SANTO;UNIVES;32
1597;FACULDADE SANTA FÉ;CESSF;21
1598;FACULDADE POLITÉCNICA DE UBERLÂNDIA;FPU;31
1599;INSTITUTO DE ENSINO SUPERIOR PRESIDENTE TANCREDO DE ALMEIDA NEVES;IPTAN;31
1600;INSTITUTO DE CIÊNCIAS DA SAÚDE;ICS;31
1601;FACULDADE CIDADE DE COROMANDEL;FCC;31
1605;FACULDADE DE ADMINISTRAÇÃO DE NOVA ANDRADINA - FANOVA;FANOVA;50
1606;FACULDADE VALE DO APORÉ;FAVA;50
1607;FACULDADE LUTERANA SÃO MARCOS;FALSM;43
1609;FACULDADE DOS CERRADOS PIAUIENSES;FCP;22
1610;FACULDADE DAS ATIVIDADES EMPRESARIAIS DE TERESINA;FAETE;22
1611;FACULDADE EDUCACIONAL DE ARAPOTI;FATI;41
1612;FACULDADE SUL BRASIL;FASUL;41
1613;FACULDADE ADVENTISTA PARANAENSE;IAP;41
1614;FACULDADE ASTORGA;FAAST;41
1615;INSTITUTO SUPERIOR DO LITORAL DO PARANÁ;ISULPAR;41
1616;FACULDADE ANGEL VIANNA;FAV;33
1618;INSTITUTO BLUMENAUENSE DE ENSINO SUPERIOR;IBES;42
1619;FACULDADE ERNESTO RISCALI;FAER;35
1620;FACULDADE SANTA RITA;FASAR;35
1621;FACULDADE NETWORK;NWK;35
1622;FACULDADE DO INTERIOR PAULISTA;FIP;35
1623;FACULDADE DE CIÊNCIAS AGRÁRIAS DE ANDRADINA;FCAA;35
1624;FACULDADE MARECHAL RONDON;FMR;35
1625;FACULDADE REUNIDA;FAR;35
1628;FACULDADE DE CIÊNCIAS HUMANAS DE AGUAÍ;FACHA;35
1632;FACULDADE PITÁGORAS DE LONDRINA;;41
1634;FACULDADE BATISTA DA SERRA;FABAVI;32
1636;CASTELLI ESCOLA SUPERIOR DE HOTELARIA;CASTELLI ESH;43
1637;FACULDADE DE CIÊNCIAS JURÍDICAS E SOCIAIS DE MACEIÓ;FAMA;27
1638;FACULDADE DO AMAZONAS;IAES;13
1639;FACULDADE HÉLIO ROCHA;FHR;29
1640;FACULDADE DE CIÊNCIAS HUMANAS E SOCIAIS;FACULDADE AGES;29
1641;FACULDADE SOCIAL DA BAHIA;FSBA;29
1642;FACULDADE DE TECNOLOGIA E CIÊNCIAS DE ITABUNA;FTC;29
1643;FACULDADE ANÍSIO TEIXEIRA DE FEIRA DE SANTANA;FAT;29
1644;FACULDADE UNIME DE EDUCAÇÃO E COMUNICAÇÃO;FEC;29
1645;FACULDADE DE TECNOLOGIA E CIÊNCIAS DE JEQUIÉ;FTC;29
1646;FACULDADE DE EDUCAÇÃO CIÊNCIAS E LETRAS DE PARAÍSO;FECIPAR;17
1647;FACULDADE DE ENSINO E CULTURA DO CEARÁ;FAECE;23
1650;FACULDADE J. SIMÕES ENSINO SUPERIOR;FABAVI;32
1651;FACULDADE DE EDUCAÇÃO;ISECUB;32
1653;FACULDADE DE GUAÇUÍ;UVV GUAÇUÍ;32
1655;FACULDADE CENECISTA DE SETE LAGOAS;FCSL;31
1656;INSTITUTO DE ENSINO SUPERIOR DE TERESINA;IEST;22
1657;FACULDADE EDUCACIONAL DE DOIS VIZINHOS;FAED;41
1658;FACULDADE INTEGRADA DA GRANDE FORTALEZA;FGF;23
1659;FACULDADE ESTÁCIO DE SÁ DE OURINHOS;FAESO;35
1660;FACULDADE DE CIÊNCIAS SOCIAIS E TECNOLÓGICAS FACITEC;FACITEC;53
1661;FACULDADE DE ADMINISTRAÇÃO ESCOLA SUPERIOR PROFESSOR PAULO MARTINS;ESPAM;53
1662;FACULDADE CAPIXABA DE ADMINISTRAÇÃO E EDUCAÇÃO;UNICES;32
1663;FACULDADE ARAGUAIA;FARA;52
1664;FACULDADE DA SAÚDE E ECOLOGIA HUMANA;FASEH;31
1665;FACULDADE KENNEDY;FK;31
1666;FACULDADE NOVOS HORIZONTES;NOVOS HORIZONTES;31
1668;FACULDADE DE NEGÓCIOS DE BELO HORIZONTE;;31
1669;INSTITUTO METROPOLITANO DE ENSINO SUPERIOR;IMES;31
1670;FACULDADE ASA DE BRUMADINHO;IECEMB - FAB;31
1672;INSTITUTO ESPERANÇA DE ENSINO SUPERIOR;IESPES;15
1674;INSTITUTO SALESIANO DE FILOSOFIA;INSAF;26
1675;FACULDADE METROPOLITANA DA GRANDE RECIFE;UNESJ;26
1676;FACULDADE SÃO MIGUEL;FACULDADE SÃO MIGUEL;26
1677;FACULDADE DE ENSINO SUPERIOR DO PIAUÍ;FAESPI;22
1678;FACULDADE DE CIÊNCIAS DE WENCESLAU BRAZ;FACIBRA;41
1679;FACULDADE DE CAMPINA GRANDE DO SUL;FACSUL;41
1680;FACULDADE DE CIÊNCIAS E TECNOLOGIA MATER CHRISTI;MATER CHRISTI;24
1681;FACULDADE DE CIÊNCIAS SOCIAIS APLICADAS IBMEC;FACULDADES IBMEC;33
1682;FACULDADE SALESIANA MARIA AUXILIADORA;FSMA;33
1683;FACULDADE PIAUIENSE;FAP;22
1685;FACULDADE BARDDAL DE CIÊNCIAS CONTÁBEIS;FB-CC;42
1686;FACULDADE BARDDAL DE ARTES APLICADAS;FB-AA;42
1689;FACULDADE SANTA IZILDINHA;FIESI;35
1690;FACULDADE DE SÃO VICENTE;FSV;35
1691;FACULDADE PRÁXIS;FIPEP;35
1692;ESCOLA SUPERIOR DE TECNOLOGIA E EDUCAÇÃO DE PORTO FERREIRA;ESPF;35
1693;FACULDADE ITANHAÉM;FAITA;35
1694;ESCOLA SUPERIOR DE CRICIÚMA - ESUCRI;ESUCRI;42
1695;FACULDADE DE EDUCAÇÃO DE BOM DESPACHO;FACEB;31
1696;FACULDADE CENTRAL DE CRISTALINA;FACEC;52
