2753;FACULDADE DE CIÊNCIAS EDUCACIONAIS CAPIM GROSSO;FACE;29
2754;FACULDADE SÃO PAULO;FSP;11
2755;FACULDADE DO VALE DO ITAJAÍ MIRIM;FAVIM;42
2756;FACULDADE ANHANGUERA DE VALPARAÍSO;FAV;52
2761;FACULDADE DO SERTÃO;UESSBA;29
2763;FACULDADE DE CIÊNCIAS GERENCIAIS DE SÃO GOTARDO;CESG;31
2766;FACULDADE EMPRESARIAL DE CHAPECÓ;FAEM;42
2770;FACULDADE UNIDA DE CAMPINAS;FACUNICAMPS;52
2771;CENTRO DE ENSINO SUPERIOR DE ILHÉUS;CESUPI;29
2773;FACULDADE DE MACAPÁ;FAMA;16
2774;Centro Universitário UNIFAFIBE;FAFIBE;35
2775;FACULDADES INTEGRADAS DESEMBARGADOR SÁVIO BRANDÃO - FAUSB;FAUSB;51
2779;FACULDADE DE INFORMÁTICA DE OURO PRETO DO OESTE;FIOURO;11
2783;FACULDADE DE TECNOLOGIA DO NORDESTE;FATENE;23
2784;FACULDADE FAE BLUMENAU;;42
2787;FACULDADES PEQUENO PRÍNCIPE;FPP;41
2791;FACULDADE DE CIÊNCIAS AGRÁRIAS E EXATAS DE PRIMAVERA DO LESTE;FCAE;51
2793;FACULDADE UNIÃO;FACULDADE UNIÃO;35
2794;FACULDADE DE CIÊNCIAS SOCIAIS E HUMANAS SOBRAL PINTO;FAIESP;51
2795;FACULDADE SÃO FRANCISCO DE ASSIS;FASFA;51
2796;FACULDADE DE IPORÁ;FAI;52
2799;FANEESP - FACULDADE NACIONAL DE EDUCAÇÃO E ENSINO SUPERIOR DO PARANÁ;FANEESP;41
2804;FACULDADE CCAA;FAC CCAA;33
2805;FACULDADE MODELO;FACIMOD;41
2806;FACULDADE EVANGÉLICA DE SÃO PAULO;;35
2808;FACULDADES ITECNE DE CASCAVEL;ITECNE;41
2810;INSTITUTO SUPERIOR DE EDUCAÇÃO ANÍSIO TEIXEIRA;ISEAT;31
2811;FACULDADE PAULUS DE TECNOLOGIA E COMUNICAÇÃO;FAPCOM;35
2814;FACULDADE SÃO SEBASTIÃO;FASS;35
2821;FACULDADE IDC;IDC;43
2826;FACULDADE NOSSA SENHORA DE FÁTIMA;FACULDADE FÁTIMA;43
2827;FACULDADE EVANGÉLICA DO PIAUI;FAEPI;22
2831;FACULDADE DOM BOSCO DE GOIOERÊ;DOM BOSCO GOIOERÊ;41
2832;INSTITUTO SUPERIOR DE EDUCAÇÃO PROGRAMUS;ISEPRO;22
2835;FACULDADE MAURÍCIO DE NASSAU;FMN;26
2836;FACULDADE SUL DA AMÉRICA;SULDAMÉRICA;52
2840;FACULDADE METODISTA DE TEOLOGIA E CIÊNCIAS HUMANAS DA AMAZÔNIA;FATEO-PVH;11
2841;FACULDADE PARANAPANEMA;FP;41
2843;FACULDADE DE CIÊNCIAS MÉDICAS E DA SAÚDE DE JUIZ DE FORA;FCMS/JF;31
2844;FACULDADE SALESIANA DOM BOSCO DE PIRACICABA;FSDB;35
2845;FACULDADE REINALDO RAMOS;FARR;25
2846;FACULDADE DE TEOLOGIA UMBANDISTA;F.T.U.;35
2849;ESCOLA SUPERIOR DOM HELDER CÂMARA;ESDHC;31
2853;FACULDADE PITÁGORAS DE TECNOLOGIA DE GUARAPARI;;32
2855;FACULDADE SÃO FRANCISCO DE ASSIS;UNIFIN;43
2859;FACULDADE DE BELÉM;FABEL;15
2870;FACULDADE SERRA DO CARMO;FASEC;17
2879;FACULDADE METROPOLITANA DE CAIEIRAS;FMC;35
2885;FACULDADE SÃO CAMILO;FASC-MG;31
2886;FACULDADE ZUMBI DOS PALMARES;FAZP;35
2891;FACULDADE BARÃO DE PIRATININGA;AES;35
2895;FACULDADE DE EDUCAÇÃO E TECNOLOGIA DA REGIÃO MISSIONEIRA;FETREMIS;43
2896;FACULDADE SATC;FASATC;42
2903;FACULDADE CONCÓRDIA;FACC;42
2904;FACULDADE JK - GUARÁ;ESAMC BRASÍLIA;53
2908;FACULDADE NATALENSE DE ENSINO E CULTURA;FANEC;24
2909;FACULDADE DO ESTADO DO MARANHÃO;FACEM;21
2910;FACULDADE VERDE NORTE;FAVENORTE;31
2911;FACULDADE PAN AMAZÔNIA;FAPAN;15
2912;FACULDADE DE CIÊNCIA E TECNOLOGIA ALBERT EINSTEIN;FACTAE;29
2915;FACULDADE CIDADE DE PATOS DE MINAS;FPM;31
2917;FACULDADE BRASIL NORTE;FABRAN;16
2918;FACULDADE DE ENSINO SUPERIOR DA AMAZÔNIA REUNIDA;FESAR;15
2922;INSTITUTO SUPERIOR DE EDUCAÇÃO DE BARRETOS;ISEB;35
2927;FACULDADE DEL REY;FDR;31
2935;FACULDADE DE TALENTOS HUMANOS;FACTHUS;31
2942;INSTITUTO SUPERIOR DE EDUCAÇÃO FRANCISCANO NOSSA SENHORA DE FÁTIMA;FATIMA;53
2944;FACULDADE DO SUL;FACSUL;29
2949;FACULDADE DO BAIXO PARNAÍBA;FAP;21
2950;ESCOLA SUPERIOR DE ADMINISTRAÇÃO, DIREITO E ECONOMIA;ESADE;43
2961;FACULDADE DO PANTANAL MATOGROSSENSE;FAPAN;51
2964;FACULDADE PROJEÇÃO DO GUARÁ;;53
2969;INSTITUTO SUPERIOR DE EDUCAÇÃO OCIDENTE;OCIDEMNTE;29
2971;FACULDADE BARRETOS;FB;35
2973;FACULDADE DE CIÊNCIAS HUMANAS E BIOLÓGICAS E DA SAÚDE;FCHBS;51
2974;FACULDADE DE CIÊNCIAS JURÍDICAS E SOCIAIS APLICADAS DE PRIMAVERA DO LESTE;FCJSA;51
3001;FACULDADE CENECISTA DE RONDONÓPOLIS;FACER;51
3004;INSTITUTO DE ENSINO SUPERIOR SANTA CECÍLIA;IESC;27
3007;FACULDADE DO INSTITUTO NACIONAL DE PÓS-GRADUAÇÃO DE CAMPINAS;FAC. INPG - CAMPINAS;35
3008;FACULDADE DO INSTITUTO NACIONAL DE PÓS-GRADUAÇÃO DE SÃO JOSÉ DOS CAMPOS;FACULDADE INPG - SJC;35
3012;FAJOPA - FACULDADE JOÃO PAULO II;FAJOPA;35
3020;FACULDADE SANTA RITA DE CÁSSIA;UNIFASC;52
3021;INSTITUTO SUPERIOR DE EDUCAÇÃO SANTA RITA DE CÁSSIA;ISESC;52
3027;FACULDADE DE CIÊNCIAS EDUCACIONAIS E SISTEMAS INTEGRADOS;FACESI;41
3029;FACULDADE DA AMAZÔNIA;FAAM;15
3034;FACULDADE DELTA;FACDELTA;29
3042;CHRISTUS FACULDADE DO PIAUÍ;CHRISFAPI;22
3051;FACULDADE TEOLÓGICA DE CIÊNCIAS HUMANAS E SOCIAIS LOGOS;FAETEL;35
3099;FACULDADE POTIGUAR DA PARAÍBA;FPB;25
3117;FACULDADE DE SAÚDE E DESENVOLVIMENTO HUMANO SANTO AGOSTINHO;FS;31
3146;FACULDADE DE ODONTOLOGIA DO RECIFE;FOR;26
3148;FACULDADE ANCHIETA DO RECIFE;FAR;26
3149;FACULDADE PITÁGORAS DE DIVINÓPOLIS - FPD;FPD;31
3151;UNIVERSIDADE COMUNITÁRIA DA REGIÃO DE CHAPECÓ;UNOCHAPECÓ;42
3154;FACULDADE DE TECNOLOGIA SENAI RIO DO SUL;SENAI RIO DO SUL;42
3155;FACULDADE DE TECNOLOGIA SENAI JARAGUÁ DO SUL;FATEC;42
3156;FACULDADE DE TECNOLOGIA SENAI BRUSQUE;SENAI/SC BRUSQUE;42
3157;INSTITUTO SUPERIOR DE EDUCAÇÃO ALMEIDA RODRIGUES;ISEAR;52
3158;INSTITUTO SUPERIOR DE EDUCAÇÃO ANGLO-AMERICANO DE FOZ DO IGUAÇU;ISEAAFI;41
3159;FACULDADE DE TECNOLOGIA SENAI FLORIANÓPOLIS;SENAI -SC - CTAI;42
3160;INSTITUTO FEDERAL DE EDUCAÇÃO, CIÊNCIA E TECNOLOGIA DE ALAGOAS;IFAL;27
3161;Instituto Federal de Educação, Ciência e Tecnologia do Sertão Pernambucano;;26
3162;INSTITUTO FEDERAL DE EDUCAÇÃO, CIÊNCIA E TECNOLOGIA  DE SANTA CATARINA;IF-SC;42
3163;INSTITUTO FEDERAL DE EDUCAÇÃO, CIÊNCIA E TECNOLOGIA DO RIO DE JANEIRO;IFRJ;33
3164;INSTITUTO FEDERAL DE EDUCAÇÃO, CIÊNCIA E TECNOLOGIA DE MATO GROSSO;IFMT;51
3165;INSTITUTO FEDERAL DE EDUCAÇÃO, CIÊNCIA E TECNOLOGIA  DO TRIÂNGULO MINEIRO;;31
3169;FACULDADE DE TECNOLOGIA IBTA CAMPINAS;IBTA;35
3170;FACULDADES INTEGRADAS ASSOCIAÇÃO DE ENSINO DE SANTA CATARINA;FASSESC;42
3171;FACULDADE EQUIPE;FAE;43
3172;UNIVERSIDADE DO ESTADO DO AMAZONAS;UEA;13
3173;FACULDADE DE TECNOLOGIA DO COMÉRCIO;FATEC-COMERCIO;31
3176;INSTITUTO SUPERIOR DE EDUCAÇÃO EQUIPE;ISEE;43
3177;FACULDADE DE ADMINISTRAÇÃO DA FESPSP;FADFESPSP;35
3180;INSTITUTO SUPERIOR DE EDUCAÇÃO UNIÃO DAS AMÉRICAS;UNIAMÉRICA;41
3182;CENTRO DE ENSINO SUPERIOR ARCANJO MIKAEL DE ARAPIRACA;CESAMA;27
3183;INSTITUTO FEDERAL DE EDUCAÇÃO, CIÊNCIA E TECNOLOGIA DE SERGIPE;IFS;28
3184;INSTITUTO FEDERAL DE EDUCAÇÃO, CIÊNCIA E TECNOLOGIA DE RORAIMA;IFRR;14
3186;FACULDADE DE SÃO ROQUE;FAEV;35
3187;INSTITUTO SUPERIOR DE EDUCAÇÃO CORAÇÃO DE JESUS;ISECJ;31
3188;INSTITUTO FEDERAL DE EDUCAÇÃO, CIÊNCIA E TECNOLOGIA DO NORTE DE MINAS GERAIS;IFNMG;31
3189;INSTITUTO FEDERAL DE EDUCAÇÃO, CIÊNCIA E TECNOLOGIA DE MINAS GERAIS;IFMG;31
3190;INSTITUTO SUPERIOR DE EDUCAÇÃO DE GARÇA;ISEG;35
3192;INSTITUTO SUPERIOR DE EDUCAÇÃO DE CAJAZEIRAS;ISEC;25
3193;FACULDADES INTEGRADAS DOS CAMPOS GERAIS;CESCAGE;41
3194;FACULDADE DE MINAS BH;FAMINAS-BH;31
3203;INSTITUTO SUPERIOR DE EDUCAÇÃO ALBERT EINSTEIN;ISALBE;53
3204;FACULDADE DE QUATRO MARCOS;FQM;51
3205;FACULDADE DE CIÊNCIAS BIOLÓGICAS E DA SAÚDE;FACISA;31
3209;FACULDADE DE ARAÇATUBA;;35
3215;FACULDADE ENTRE RIOS DO PIAUÍ;FAERPI;22
3216;FACULDADE DE CIÊNCIAS DA BAHIA - FACIBA;FACIBA;29
3223;ESCOLA SUPERIOR DE CIÊNCIAS DA SAÚDE;ESCS;53
3224;FACULDADE DE FARMÁCIA E BIOQUÍMICA;ITPAC;17
3225;FACULDADE DE ENFERMAGEM;ITPAC;17
3226;FACULDADE DE MEDICINA;ITPAC;17
3227;FACULDADE DE SISTEMA DE INFORMAÇÃO;ITPAC;17
3228;FACULDADE DE ADMINISTRAÇÃO;ITPAC;17
3230;FACULDADE LUIZ EDUARDO MAGALHÃES;FILEM;29
3232;FACULDADE IGUAÇU;FI;41
3238;FACULDADE DE ODONTOLOGIA;ITPAC;17
3252;FACULDADE QUIRINÓPOLIS;FAQUI;52
3268;FACULDADE MADRE THAIS;FMT;29
3270;FACULDADE SÃO BENTO DA BAHIA;;29
3279;INSTITUTO FEDERAL DE EDUCAÇÃO, CIÊNCIA E TECNOLOGIA DO SUDESTE DE MINAS GERAIS;IFSEMG;31
3285;FACULDADE SANTO ANTONIO;FSA;29
3294;FACULDADE DE TECNOLOGIA ENIAC-FAPI;ENIAC;35
3295;FACULDADE DE TECNOLOGIA SENAC FLORIANÓPOLIS;SENAC FLORIANÓPOLIS;42
3299;FACULDADE DE TECNOLOGIA INFORMÁTICA;FATI;23
3302;INSTITUTO SUPERIOR DE EDUCAÇÃO DE JUNQUEIRÓPOLIS;ISEJ;35
3303;FACULDADES INTEGRADAS MATO-GROSSENSES DE CIÊNCIAS SOCIAIS E HUMANAS;ICE;51
3304;FACULDADES INTEGRADAS DE PATOS;FIP;25
3306;FACULDADE DE TECNOLOGIA IPUC;FATIPUC;43
3307;FACULDADE INED DE RIO CLARO;CBTA;35
3308;FACULDADE DE TECNOLOGIA TERMOMECÂNICA;FTT;35
3309;FACULDADE DE TECNOLOGIA INTERNACIONAL;FATEC INTERNACIONAL;41
3311;FACULDADE DE TECNOLOGIA SÃO FRANCISCO;FATESF;32
3319;FACULDADE DE ENSINO SUPERIOR DE CATALÃO;FACULDADE CESUC;52
3323;INSTITUTO DE EDUCAÇÃO E ENSINO SUPERIOR DE CAMPINAS;IESCAMP;35
3332;FACULDADE DE TECNOLOGIA SENAC RIO;FATEC;33
3333;FACULDADE DE TECNOLOGIA TECBRASIL;Ftec Caxias do Sul;43
3336;UNIVERSIDADE ESTADUAL DO RIO GRANDE DO SUL;UERGS;43
3337;FACULDADE DE TECNOLOGIA DE TERESINA;FACULDADE CET;22
3339;FACULDADE DE GETÚLIO VARGAS;FACULDADE IDEAU;43
3360;INSTITUTO DE EDUCAÇÃO SUPERIOR PRESIDENTE KENNEDY - CENTRO DE FORMAÇÃO DE PROFISSIONAIS DE EDUCAÇÃO;IFESP;24
3363;FACULDADE GUARAÍ;FAG;17
3365;FACULDADE SÃO FRANCISCO DE JUAZEIRO;FASJ;29
3367;INSTITUTO SUPERIOR DE EDUCAÇÃO DE OLIVEIRA;ISEOL;31
3368;CENTRO UNIVERSITÁRIO DO SUL DE MINAS;UNIS-MG;31
3371;CENTRO UNIVERSITÁRIO DE PATOS DE MINAS;UNIPAM;31
3372;CENTRO UNIVERSITÁRIO DE LAVRAS;UNILAVRAS;31
3375;INSTITUTO DE ENSINO SUPERIOR MÚLTIPLO;IESM;21
3376;FACULDADE DE TEOLOGIA INTEGRADA;FATIN;26
3377;FACULDADE MONTESSORIANO DE SALVADOR;FAMA;29
3380;FACULDADE MISSIONEIRA DO PARANÁ;FAMIPAR;41
3388;FACULDADE PARAÍSO DO CEARÁ;FAP;23
3389;FACULDADE RAÍZES;SER;52
3392;FACULDADE DA ACADEMIA BRASILEIRA DE EDUCAÇÃO E CULTURA;FABEC;33
3393;FACULDADE DE ENSINO SUPERIOR DOM BOSCO;FACDOMBOSCO;41
3396;FACULDADE LS;FACELS;53
3397;FACULDADE BOAS NOVAS DE CIÊNCIAS TEOLÓGICAS, SOCIAIS E BIOTECNOLÓGICAS;FBNCTSB;13
3400;FACULDADE DE SAÚDE DE SÃO PAULO;FASSP;35
3411;FACULDADE EÇA DE QUEIROS;FACEQ;35
3427;FACULDADE JOSÉ AUGUSTO VIEIRA;FJAV;28
3428;FACULDADE ALFA;FA;35
3430;FACULDADE DE MARKETING E NEGÓCIOS;UNIESSA;31
3431;FACULDADE DO SERIDÓ;FAS;24
3432;FACULDADES INTEGRADAS DE CIÊNCIAS HUMANAS, SAÚDE E EDUCAÇÃO DE GUARULHOS;FG;35
3434;FACULDADE DE SAÚDE IBITURUNA;FASI;31
3436;Faculdade de Araraquara;FS;35
3437;FACULDADE DO LITORAL CATARINENSE;FLC;42
3443;FACULDADE INEDI;CESUCA;43
3448;INSTITUTO SUPERIOR DE EDUCAÇÃO IBITURUNA;ISEIB;31
3456;FACULDADE POLITÉCNICA DE CAMPINAS;POLICAMP;35
3459;INSTITUTO DE ENSINO SUPERIOR E PESQUISA;INESP;31
3460;INSTITUTO SUPERIOR DE ENSINO E PESQUISA DE ITUIUTABA;ISEPI;31
3461;FACULDADE DE FILOSOFIA DE PASSOS;FAFIPA;31
3462;FACULDADE DE ENFERMAGEM DE PASSOS;FAENPA;31
3463;FACULDADE DE DIREITO DE PASSOS;FADIPA;31
3464;FACULDADE DE ENGENHARIA DE PASSOS;FEP;31
3465;FACULDADE DE INFORMÁTICA DE PASSOS;FIP;31
3466;FACULDADE DE SERVIÇO SOCIAL DE PASSOS;FASESP;31
3467;FACULDADE DE NUTRIÇÃO DA FUNDAÇÃO DE ENSINO SUPERIOR DE PASSOS;FANUTRI;31
3469;FACULDADE DE ADMINISTRAÇÃO DE PASSOS;FAP;31
3470;FACULDADE EDUCAÇÃO FÍSICA DE PASSOS;FADEF;31
3471;FACULDADE DE MODA DE PASSOS;FAMOPA;31
3476;FACULDADE DE FILOSOFIA E LETRAS DE DIAMANTINA;FAFIDIA;31
3477;FACULDADE DE FILOSOFIA CIÊNCIAS E LETRAS NOSSA SENHORA DE SION;FAFI/SION;31
3478;FACULDADE DE CIÊNCIAS EXATAS E HUMANAS DA CAMPANHA;FCCP;31
3480;FACULDADE DE CIÊNCIAS JURÍDICAS DE DIAMANTINA;FCJ;31
3482;INSTITUTO SUPERIOR DE EDUCAÇÃO DE DIVINÓPOLIS;ISED;31
3483;INSTITUTO SUPERIOR DE EDUCAÇÃO DE CLÁUDIO;ISEC;31
3485;INSTITUTO SUPERIOR DE EDUCAÇÃO DO ALTO SÃO FRANCISCO;ISAF;31
3486;INSTITUTO SUPERIOR DE EDUCAÇÃO DE ITUIUTABA;ISEDI;31
3487;FACULDADE SENAC/RS;SENACRS;43
3488;Centro de Ensino Superior de Conselheiro Lafaiete;CES-CL;31
3495;FACULDADE PINHALZINHO;HORUS;42
3502;FACULDADE DA FRONTEIRA - FAF;FAF;41
3506;FACULDADE DE CIÊNCIAS EDUCACIONAIS DE SERGIPE;FCES;28
3507;FACULDADE DE ADMINISTRAÇÃO DE EMPRESAS IBRAFEM;IBRAFEM;35
3509;FACULDADE VICENTINA - FAVI;FAVI;41
3513;FACULDADE DE PRESIDENTE VENCESLAU;FAPREV;35
3514;FACULDADE DE CIÊNCIAS GERENCIAIS ALVES FORTES;FACE - ALFOR;31
3515;FACULDADES INTEGRADAS DA VITÓRIA DE SANTO ANTÃO;FAINTVISA;26
3516;FACULDADE DE CIÊNCIAS DA SAÚDE ARCHIMEDES THEODORO;FAC - SAUDE ARTHE;31
3518;FACULDADE JANGADA;FJ;42
3522;FACULDADE CATÓLICA DE POUSO ALEGRE;FACAPA;31
3523;FACULDADE DE DIREITO DA FUNDAÇÃO ESCOLA SUPERIOR DO MINISTÉRIO PÚBLICO;;43
3525;FACULDADE EVANGÉLICA DE TECNOLOGIA, CIÊNCIAS E BIOTECNOLOGIA DA CGADB;FAECAD;33
3529;CENTRO UNIVERSITÁRIO EURÍPEDES DE MARÍLIA;UNIVEM;35
3530;FACULDADE DE NANUQUE;FANAN;31
3533;FACULDADE CERES;FACERES;35
3536;FACULDADE DE TEOLOGIA EVANGÉLICA EM CURITIBA - FATEV;FATEV;41
3538;FACULDADES INTEGRADAS SÉVIGNÉ;FAE SÉVIGNÉ;43
3541;FACULDADE ANGLICANA DE TAPEJARA;FAT;43
3542;INSTITUTO DE ENSINO SUPERIOR DE MINAS GERAIS;IESMIG;31
3543;FACULDADE NOVO HAMBURGO;FACULDADE IENH;43
3568;FACULDADE DE DESENVOLVIMENTO E INTEGRAÇÃO REGIONAL;FADIRE;26
3573;FACULDADE TEOLÓGICA BATISTA DE BRASÍLIA;FTBB;53
3584;INSTITUTO SUPERIOR DE EDUCAÇÃO SANTA CRUZ;ISED;26
3585;FACULDADE SANTA CRUZ;FACRUZ;26
3587;FACULDADE DIOCESANA SÃO JOSÉ;FADISI;12
3588;FACULDADE DOM PEDRO II;FDPII;29
3590;FACULDADE DE ENFERMAGEM SÃO VICENTE DE PAULA;FESVIP;25
3596;FACULDADE AMÉRICA LATINA;;43
3602;FACULDADES INTEGRADAS DO BRASIL;FACBRASIL;41
3603;FACULDADES INTEGRADAS TORRICELLI;FIT;35
3607;ESCOLA SUPERIOR ASSOCIADA DE GOIÂNIA;ESUP;52
3609;FACULDADES INTEGRADAS IPITANGA;UNIBAHIA;29
3610;FACULDADES INTEGRADAS PROMOVE DE BRASILIA;;53
3611;FACULDADES INTEGRADAS DA UNIÃO DE ENSINO SUPERIOR CERTO;UNICERTO;53
3612;FACULDADE ANHANGUERA DE VALINHOS;;35
3613;FACULDADES INTEGRADAS IESGO;IESGO;52
3614;ESCOLA SUPERIOR DE CIÊNCIAS SOCIAIS;FGV;33
3615;FACULDADE PERNAMBUCANA DE SAÚDE;FPS;26
3617;FACULDADE DE CIÊNCIAS HUMANAS E EXATAS DO SERTÃO DO SÃO FRANCISCO;FACESF;26
3618;FACULDADE MARIO SCHENBERG;FMS;35
3625;FACULDADE CATÓLICA NOSSA SENHORA DAS VITÓRIAS;FCNSV;24
3631;FACULDADE DAMAS DA INSTRUÇÃO CRISTÃ;FADIC;26
3641;CENTRO UNIVERSITÁRIO DA FUNDAÇÃO EDUCACIONAL DE BARRETOS;UNIFEB;35
3644;FACULDADE CATÓLICA SANTA TERESINHA;FCST;24
3648;FACULDADE ANHANGUERA DE CUIABÁ;FAC;51
3649;FACULDADE CIDADE VERDE;FCV;41
3657;FACULDADE DE COMPUTAÇÃO DE MONTES CLAROS;FACOMP;31
3663;FACULDADE EVANGÉLICA;FE;53
3667;FACULDADE FILADÉLFIA;FAFIL;35
3669;FACULDADE DOM LUIS DE ORLEANS E BRAGANÇA;FARRP;29
3675;SINAL - FACULDADE DE TEOLOGIA E FILOSOFIA;SINAL;12
3680;FACULDADE DE TECNOLOGIA DARCY RIBEIRO;FTDR;23
3682;INSTITUTO SUPERIOR DE EDUCAÇÃO DO MUNICÍPIO DE ITAPERUNA;ISEMI;33
3683;FACULDADE UNILAGOS;UNILAGOS;41
3684;FUNDAÇÃO DE ENSINO SUPERIOR DE CLEVELÂNDIA;FESC;41
3688;FACULDADES INTEGRADAS DO VALE DO IVAÍ;;41
3690;FACULDADE PEDRO II;FAPE2;31
3691;FACULDADE DE TECNOLOGIA TUPY DE SÃO BENTO DO SUL;FTT-SBS;42
3692;FACULDADE DE TECNOLOGIA IPEP DE CAMPINAS;FATEC CAMPINAS;35
3697;FACULDADE DE TECNOLOGIA SAINT PASTOUS;FSP;43
3699;FACULDADE PORTAL;PORTAL;43
3710;ESCOLA SUPERIOR NACIONAL DE SEGUROS;ESNS;33
3716;FACULDADE CIÊNCIAS DA VIDA;FCV;31
3724;FACULDADE MARANHENSE SÃO JOSÉ DOS COCAIS;FSJ;21
3741;FACULDADE DE EDUCAÇÃO DE BACABAL - FEBAC;FEBAC;21
3743;FACULDADE DE TECNOLOGIA SÃO FRANCISCO;FATESF;35
3746;FACULDADE PAULISTA DE PESQUISA E ENSINO SUPERIOR;FAPPES;35
3753;FACULDADES INTEGRADAS DOM PEDRO II;DOMPEDRO;35
3754;FACULDADES INTEGRADAS ADVENTISTAS DE MINAS GERAIS;FADMINAS;31
3756;FACULDADE DE ALMENARA;ALFA;31
3757;FACULDADE SERRA DA MESA;FASEM;52
3758;Centro de Educação Superior Única;UNICA;42
3760;FACULDADE OMNI;OMNI;33
3768;FACULDADE IBGEN - INSTITUTO BRASILEIRO DE GESTÃO DE NEGÓCIOS;IBGEN;43
3769;FACULDADE MADRE TEREZA;FAMAT;16
3770;FACULDADE TEOLÓGICA BATISTA DE SÃO PAULO;FTBSP;35
3772;FACULDADE DE TECNOLOGIA PASTOR DOHMS;TECNODOHMS;43
3774;FACULDADE SÃO TOMAZ DE AQUINO;FSTA;29
3775;INSTITUTO UVB.BR;IUVB;35
3776;INSTITUTO DE ENSINO SUPERIOR DE MATO GROSSO;IESMT;51
3777;INSTITUTO DE ENSINO SUPERIOR DE CURITIBA;IESC;41
3778;FACULDADE DE ARACAJU;FACAR;28
3779;FACULDADE DE TECNOLOGIA RADIAL SANTO ANDRÉ;FATEC  RADIAL;35
3782;FACULDADE DE TECNOLOGIA CACHOEIRO DE ITAPEMIRIM;FACI;32
3783;FACULDADE PARAENSE DE ENSINO;FAPEN;15
3784;INSTITUTO DE ENSINO SUPERIOR DO RIO GRANDE DO NORTE;IESRN;24
3785;INSTITUTO MARANHENSE DE ENSINO E CULTURA;IMEC;21
3786;FACULDADE DE ENSINO DE MINAS GERAIS;FACEMG;31
3787;FACULDADE DE ENSINO SUPERIOR DA AMAZÔNIA;FESAM;16
3788;FACULDADE JUIZ DE FORA;FJF;31
3789;FACULDADE EVANGÉLICA DE GOIANÉSIA;;52
3790;FACULDADE DE TECNOLOGIA ENSITEC;ENSITEC;41
3793;FACULDADE FRUTAL;FAF;31
3794;FACULDADE DE TECNOLOGIA DE MINAS GERAIS;FATEMG;31
3797;FACULDADE GUAIRACÁ;FAG;41
3803;FACULDADE JAUENSE;;35
3804;FACULDADE DE TECNOLOGIA SENAC DO RIO GRANDE DO SUL;SENAC/RS;43
3805;FACULDADE DE TECNOLOGIA DA PARAÍBA;FATECPB;25
3807;FACULDADE DE TECNOLOGIA IAPEC;IAPEC;41
3815;FACULDADE DE DIREITO DE ALTA FLORESTA;;51
3817;FACULDADE MAURÍCIO DE NASSAU DE JOÃO PESSOA;FMN JOÃO PESSOA;25
3823;INSTITUTO DE EDUCAÇÃO SUPERIOR DE POUSO ALEGRE;FAPA;31
3826;FACULDADE VASCO DA GAMA;FVG;29
3838;FACULDADE DE TECNOLOGIA DO UNIUOL;UNIUOL;25
3839;FACULDADE DE TECNOLOGIA NOVO RUMO;;31
3840;CENTRO UNIVERSITÁRIO FACVEST;FACVEST;42
3847;FACULDADE BAIANA DE DIREITO E GESTÃO;;29
3849;FUNDAÇÃO UNIVERSIDADE FEDERAL DO TOCANTINS;UFT;17
3853;FACULDADE MAURÍCIO DE NASSAU DE NATAL;FMN NATAL;24
3854;FACULDADE DAS ÁGUAS EMENDADAS - FAE;FAE;53
3862;FACULDADE LUCIANO FEIJÃO;FLF;23
3864;FACULDADE REGIONAL DE ALAGOINHAS;FARAL;29
3866;FACULDADE BRASILEIRA DE EDUCAÇÃO E CULTURA;FABEC BRASIL;52
3867;FACULDADE MAUÁ DE BRASÍLIA;MAUADF;53
3869;INSTITUTO FLORENCE DE ENSINO SUPERIOR;IFES;21
3874;ESCOLA SUPERIOR PROFESSOR PAULO MARTINS;ESPAM;53
3875;CENTRO UNIVERSITÁRIO DA FUNDAÇÃO EDUCACIONAL GUAXUPÉ;UNIFEG;31
3876;AVM - FACULDADE INTEGRADA;IAVM;33
3877;FACULDADE BRASIL CENTRAL;FBC;52
3878;FACULDADE DECISION DE NEGÓCIOS;FACULDADE DECISION;43
3879;FACULDADE MAURÍCIO DE NASSAU DE CAMPINA GRANDE;FMN CG;25
3881;FACULDADE DE INTEGRAÇÃO DO SERTÃO;FIS;26
3896;FACULDADE MUNDIAL;;35
3920;FACULDADE DE TECNOLOGIA SENAI ROBERTO MANGE;FATEC SENAI RM;52
3921;FACULDADE ARNALDO HORÁCIO FERREIRA;FAAHF;29
3930;INSTITUTO DE EDUCAÇÃO SUPERIOR RAIMUNDO SÁ;IESRSA;22
3933;FACULDADE MÉTODO DE SÃO PAULO;FAMESP;35
3936;FACULDADE ANHANGUERA DE LIMEIRA;;35
3937;Faculdade Anhanguera de Indaiatuba;;35
3939;FACULDADE ALIANÇA;;52
3940;FACULDADE DE ENSINO SUPERIOR SANTA BARBARA;FAESB;35
3946;FACULDADE DE TECNOLOGIA SENAC TUBARÃO;SENAC;42
3947;FACULDADE DE TECNOLOGIA SENAC CHAPECÓ;SENAC;42
3948;FACULDADE DE TECNOLOGIA SENAC BLUMENAU;SENAC;42
3951;FACULDADE DE TECNOLOGIA LUIZ ADELAR SCHEUER;FATEC- JF;31
3954;FACULDADE DE CIÊNCIAS JURÍDICAS E GERENCIAIS DE OLIVEIRA;FACIJUGO;31
3955;FACULDADES INTEGRADAS DE CATAGUASES;FIC;31
3962;FACULDADE DE TECNOLOGIA SENAI CIMATEC;SENAI CIMATEC;29
3963;INSTITUTO SUPERIOR DE EDUCAÇÃO CARLOS CHAGAS;ISECC;31
3966;CENTRO UNIVERSITÁRIO DE CARATINGA;UNEC;31
3972;CENTRO SUPERIOR DE ENSINO E PESQUISA DE MACHADO;CESEP;31
3974;UNIVERSIDADE DE RIO VERDE;FESURV;52
3975;FACULDADE SÃO FRANCISCO DE PIUMHI;FASPI;31
3977;FACULDADE DE TECNOLOGIA DO AMAPÁ;META;16
3978;FACULDADE DE TECNOLOGIA PENTÁGONO;FATEP;35
3979;FACULDADE DE BAURU;-;35
3980;FACULDADE DE TECNOLOGIA CENACAP;CENACAP;53
3981;FACULDADE DE TECNOLOGIA INTEGRAL;CETI;41
3983;CENTRO UNIVERSITÁRIO DE FORMIGA;UNIFORMG;31
3984;FUNDAÇÃO UNIVERSIDADE FEDERAL DO VALE DO SÃO FRANCISCO;UNIVASF;26
3985;CENTRO UNIVERSITÁRIO SENAC;SENACSP;35
3986;INSTITUTO SUPERIOR DE EDUCAÇÃO DO PARANÁ;INSEP;41
3987;FACULDADE UNIÃO DE GOYAZES;FUG;52
3989;FACULDADE DE TECNOLOGIA DE JOÃO PESSOA;FATEC;25
3990;FACULDADE DE TECNOLOGIA ANCHIETA;FTA;35
3991;FACULDADE DE TECNOLOGIA SÃO MATEUS;FATESM;11
3992;FACULDADE JK - ASA NORTE;-;53
3993;FACULDADE DE TECNOLOGIA CETEP;CETEP;41
3995;FACULDADE EVANGÉLICA CRISTO REI;FECR;22
3996;FACULDADE SENAC PERNAMBUCO;SENACPE;26
3998;FACULDADE DE TECNOLOGIA INFNET RIO DE JANEIRO;INSTITUTO INFNET;33
4000;FACULDADE DE ENSINO SUPERIOR DO INTERIOR PAULISTA;FAIP;35
4005;FACULDADE CENECISTA DE SENHOR DO BONFIM;FACESB;29
4006;FACULDADE DE TECNOLOGIA SENAC PELOTAS;FATEC SENAC PELOTAS;43
4007;FATECE - FACULDADE DE TECNOLOGIA, CIÊNCIAS E EDUCAÇÃO;FATECE;35
4008;FACULDADE DE TECNOLOGIA SENAC PASSO FUNDO;SENAC PASSO FUNDO;43
4009;FACULDADE DE TECNOLOGIA RADIAL CURITIBA;FATEC RADIAL CTBA;41
4010;CENTRO UNIVERSITÁRIO METODISTA;IPA;43
4013;FACULDADE ANHANGUERA DE RIO CLARO;;35
4016;INSTITUTO NACIONAL DE EDUCAÇÃO DE SURDOS;INES;33
4017;CENTRO UNIVERSITÁRIO PADRE ANCHIETA;UNIANCHIETA;35
4020;FACULDADE DE TECNOLOGIA DE BOTUCATU;FATEC BT;35
4021;FACULDADE DE TECNOLOGIA DE GARÇA;FATECGA;35
4022;FACULDADE DE TECNOLOGIA DE JUNDIAÍ;FATEC/JD;35
4023;FACULDADE DE TECNOLOGIA DE MAUÁ;FATEC MAUÁ;35
4024;FACULDADE DE TECNOLOGIA DE MOCOCA;FATEC;35
4025;FACULDADE DE TECNOLOGIA DE SÃO JOSÉ DO RIO PRETO;FATECRP;35
4026;FACULDADE DE TECNOLOGIA ZONA LESTE;FATEC-ZL;35
4028;FACULDADE DE ITAPECERICA DA SERRA;FIT;35
4029;FACULDADE POLITEC;FAP;35
4030;CENTRO UNIVERSITÁRIO FLUMINENSE;UNIFLU;33
4036;FACULDADE DE TECNOLOGIA DE CATALÃO;FATECA;52
4037;FACULDADE DE TECNOLOGIA INTENSIVA;FATECI;23
4043;FACULDADE TECNOLOGIA EDUVALE - AVARÉ;FATEC EDUVALE;35
4045;FACULDADE DE TECNOLOGIA TUPY CURITIBA;FTT-CWB;41
4053;CENTRO DE EDUCAÇÃO SUPERIOR BARNABITA;CESB;31
4059;FACULDADE DE CIÊNCIAS GERENCIAIS;;35
4064;FACULDADE DE TECNOLOGIA FAMA;FAMA;26
4066;FACULDADE BATISTA DO ESTADO DO RIO DE JANEIRO - FABERJ;FABERJ;33
4068;INSTITUTO SUPERIOR DE EDUCAÇÃO DO ICESP;ISE-ICESP;53
4077;FACULDADE DE TECNOLOGIA DE GRAVATAÍ;FAQI;43
4079;FACULDADE TECNOLÓGICA INAP;FAT- INAP;31
4086;FACULDADE DE TECNOLOGIA JARDIM;FATEJ;35
4090;FACULDADE DE ROSEIRA;FARO;35
4092;FACULDADE DE TECNOLOGIA PEDRO ROGÉRIO GARCIA;FATTEP;42
4093;FACULDADE DE TECNOLOGIA DE CURITIBA;FATEC-PR;41
4094;FACULDADE DE TECNOLOGIA IBRATEC DE JOÃO PESSOA;UNIBRATEC;25
4095;FACULDADE DE TECNOLOGIA EQUIPE DARWIN;FTED;53
4096;FACULDADE DE TECNOLOGIA TECBRASIL - UNIDADE PORTO ALEGRE;Ftec Porto Alegre;43
4097;FACULDADE DE TECNOLOGIA TECBRASIL - UNIDADE BENTO GONÇALVES;Ftec Bento Gonçalves;43
4098;INSTITUTO FEDERAL DE EDUCAÇÃO, CIÊNCIA E TECNOLOGIA FARROUPILHA;IFFarroupilha;43
4100;FACULDADE DE TECNOLOGIA SENAI ÍTALO BOLOGNA;FATECIB;52
4101;FACULDADE DE TECNOLOGIA SENAI DE DESENVOLVIMENTO GERENCIAL;FATESG;52
4104;ESCOLA SUPERIOR DE ENGENHARIA E GESTÃO DE SÃO PAULO - ESEG;ESEG;35
4107;FACULDADE DE TECNOLOGIA SENAI PORTO ALEGRE;FATEC SENAI;43
4108;INSTITUTO CATÓLICO DE ESTUDOS SUPERIORES DO PIAUÍ;ICESPI;22
4113;FACULDADE DE CERES;FACERES;52
4118;FACULDADE JOAQUIM NABUCO - PAULISTA;FJN;26
4121;FACULDADE TOBIAS BARRETO;FTB;28
4123;FACULDADE JATAIENSE;FAJA;52
4126;FACULDADE DE CIÊNCIAS SOCIAIS APLICADAS E DE TECNOLOGIAS DE AGUA BOA;FACESA;51
4138;FACULDADE ANHANGUERA DE SANTA BÁRBARA;;35
4141;FACULDADE ANHANGUERA DE TAUBATÉ;;35
4146;FACULDADE DE CIÊNCIAS JURÍDICAS DE ALAGOAS;FCJAL;27
4148;FACULDADE DE TECNOLOGIA SENAI SÃO JOSÉ;SENAISC;42
4149;FACULDADE DE TECNOLOGIA SENAI ITAJAÍ;FATEC SENAI ITAJAÍ;42
4150;FACULDADE DE TECNOLOGIA DE PIRACICABA;FATEP;35
4153;FACULDADE JOAQUIM NABUCO RECIFE;FJN;26
4157;FACULDADE METROPOLITANA DE RIO DO SUL;FAMESUL;42
4162;FACULDADE DE TECNOLOGIA SENAC GOIÁS;;52
4163;CENTRO UNIVERSITÁRIO BARRIGA VERDE;UNIBAVE;42
4166;CENTRO DE ENSINO SUPERIOR DE UBERABA;CESUBE;31
4169;FACULDADE NOSSA CIDADE;FNC;35
4173;FACULDADE DE TECNOLOGIA PAULO FREIRE;FATEP-DF;53
4178;FACULDADE EVILÁSIO FORMIGA;FEF;25
4179;FACULDADE NAZARENA DO BRASIL;FNB;35
4185;FACULDADE PERUIBE;FPBE;35
4197;FACULDADE ALIANÇA;FACE;22
4198;FACULDADE MINEIRENSE;FAMA;52
4199;FACULDADE DE TECNOLOGIA ROGACIONISTA;ROGA;53
4200;FACULDADE DE COMUNICAÇÃO SOCIAL DE PASSOS;FACOMP;31
4201;FACULDADE DE ENSINO SUPERIOR DO NORDESTE;FAESNE;25
4204;FACULDADE DE TECNOLOGIA INED - UNIDADE IPATINGA;FATEC IPATINGA;31
4209;FACULDADE DE TECNOLOGIA CÉSAR LATTES;;35
4218;FACULDADE DE DIREITO DE PEDRO LEOPOLDO;FADIPEL;31
4219;INSTITUTO SUPERIOR DE EDUCAÇÃO PROFESSORA NAIR FORTES ABU-MERHY;ISEFOR;31
4222;INSTITUTO SUPERIOR DE EDUCAÇÃO DE MATIAS BARBOSA;ISEMB;31
4239;FACULDADE AÇÃO;FCTVALE;42
4251;FACULDADE DE TECNOLOGIA INED - UNIDADE LAGOA DA PAMPULHA;FATEC/PITÁGORAS;31
4255;FACULDADES INTEGRADAS DE CACOAL;UNESC;11
4256;FACULDADES INTEGRADAS PITÁGORAS;FIP-MOC;31
4257;INSTITUTO DE FILOSOFIA E TEOLOGIA DE GOIÁS;IFITEG;52
4259;FACULDADE DE INHUMAS - FAC-MAIS;FACMAIS;52
4261;FACULDADE DE TECNOLOGIA DE PORTO ALEGRE;FAQI;43
4277;FACULDADE LITERATUS;FAL;13
4289;FACULDADE DO VALE ELVIRA DAYRELL - FAVED;FAVED;31
4293;FACULDADE INTEGRAÇÃO TIETE;FIT;35
4294;FACULDADE DE TECNOLOGIA SENAC JARAGUÁ DO SUL;;42
4295;FACULDADE DE TECNOLOGIA SENAI CETIND;;29
4329;FACULDADE DO CENTRO EDUCACIONAL MINEIRO - FACEM;FACEM-BH;31
4330;FACULDADE DE TECNOLOGIA AMÉRICA DO SUL;;41
4355;FACULDADE DE TECNOLOGIA DE PALMAS;FTP;17
4356;FACULDADE DE CIÊNCIAS SOCIAIS DOS PALMARES;FACIP;26
4357;FACULDADE DE TECNOLOGIA ÁLVARES DE AZEVEDO;FAATESP;35
4358;INSTITUTO FEDERAL DE EDUCAÇÃO, CIÊNCIA E TECNOLOGIA DO SUL DE MINAS GERAIS;IF SUL DE MINAS;31
4362;FACULDADE PITÁGORAS DE BETIM;PITÁGORAS-BETIM;31
4367;FACULDADE TERRA NORDESTE;FATENE;23
4371;FACULDADE PADRE ANCHIETA DE CAJAMAR;;35
4394;FACULDADE DE EDUCAÇÃO FÍSICA DE ARAGUAÍNA;ITPAC;17
4396;FACULDADES INTEGRADAS DE MINEIROS;FIMES;52
4398;INSTITUTO SUPERIOR DE EDUCAÇÃO DE GOIANA;I.S.E.G.;26
4399;FACULDADE DE BALSAS;UNIBALSAS;21
4411;FACULDADE PANAMERICANA DE JI-PARANÁ;;11
4416;FACULDADE JK - UNIDADE I - GAMA;;53
4417;FACULDADE DE ENFERMAGEM DE BELO JARDIM;FAEB;26
4420;FACULDADES INTEGRADAS BARROS MELO;FIBAM;26
4421;FACULDADE DE TECNOLOGIA SENAI BELO HORIZONTE;FATEC SENAI BH;31
4428;FACULDADE PROFESSOR MIGUEL ÂNGELO DA SILVA SANTOS;FEMASS;33
4429;FACULDADE UNIGRAN CAPITAL;UNIGRAN CAPITAL;50
4431;FACULDADE DE ENFERMAGEM NOVA ESPERANÇA DE MOSSORÓ - FACENE/RN;FACENE/RN;24
4435;FACULDADE SÃO PAULO;FACSP;35
4442;ESCOLA SUPERIOR PAULISTA DE ADMINISTRAÇÃO - ESPA;ESPA;35
